-------------------SBATCH STATS-------------------
Total CPU cores:      6
Visible CPU cores:    3
Visible GPUs:         NVIDIA GeForce RTX 3060
--------------------------------------------------
Namespace(dataset='CIFAR10', model_type='ResNet', size=20, batch_norm=True, 
width=4.0, epochs=200, lr=0.4, weight_decay=0.0001, variant='a', wandb=True, 
test=True, checkpoint_midway=False)
wandb: Currently logged in as: epistoteles. Use `wandb login --relogin` to force relogin
wandb: wandb version 0.16.0 is available!  To upgrade, please run:
wandb:  $ pip install wandb --upgrade
wandb: Tracking run with wandb version 0.15.3
wandb: Run data is saved locally in /home/korbinian/Documents/partial-model-merging/wandb/run-20231122_192807-s370150s
wandb: Run `wandb offline` to turn off syncing.
wandb: Syncing run revived-field-196
wandb: ⭐️ View project at https://wandb.ai/epistoteles/partial-model-merging
wandb: 🚀 View run at https://wandb.ai/epistoteles/partial-model-merging/runs/s370150s
Working... ━━━━━━━━━━━━━━━━━━━━━━━━━━━━━━━━━━━━━━━━ 100% 0:46:45
📥 Accuracies and losses saved for CIFAR10-ResNet20-bn-4.0x-a
train_acc    1.0
train_loss   0.0001351658726343885
test_acc     0.9475
test_loss    0.20251352787017823
wandb: Waiting for W&B process to finish... (success).
wandb: 
wandb: Run history:
wandb:          epoch ▁▁▁▁▂▂▂▂▂▃▃▃▃▃▃▄▄▄▄▄▅▅▅▅▅▅▆▆▆▆▆▇▇▇▇▇▇███
wandb:  learning_rate ▄███▇▇▇▇▇▇▆▆▆▆▆▅▅▅▅▅▅▄▄▄▄▄▃▃▃▃▃▃▂▂▂▂▂▁▁▁
wandb:  test_accuracy ▁▄▆▇▇▇▆▆▇▇▇▇▇▇▇▇▇█▇▇▇▇▇▇▇██▇████████████
wandb:      test_loss █▄▂▂▂▂▄▃▂▂▂▂▂▂▂▂▂▂▂▂▂▂▂▂▂▁▂▂▁▁▁▁▁▁▁▁▁▁▁▁
wandb: train_accuracy ▁▅▇▇▇▇▇▇████████████████████████████████
wandb:     train_loss █▄▃▂▂▂▂▂▁▁▁▁▁▁▁▁▁▁▁▁▁▁▁▁▁▁▁▁▁▁▁▁▁▁▁▁▁▁▁▁
wandb: 
wandb: Run summary:
wandb:          epoch 199
wandb:  learning_rate 0.0
wandb:  test_accuracy 0.9475
wandb:      test_loss 0.20251
wandb: train_accuracy 1.0
wandb:     train_loss 0.00042
wandb: 
wandb: 🚀 View run revived-field-196 at: https://wandb.ai/epistoteles/partial-model-merging/runs/s370150s
wandb: Synced 5 W&B file(s), 0 media file(s), 2 artifact file(s) and 0 other file(s)
wandb: Find logs at: ./wandb/run-20231122_192807-s370150s/logs
Namespace(dataset='CIFAR10', model_type='ResNet', size=20, batch_norm=True, 
width=4.0, epochs=200, lr=0.4, weight_decay=0.0001, variant='b', wandb=True, 
test=True, checkpoint_midway=False)
wandb: Currently logged in as: epistoteles. Use `wandb login --relogin` to force relogin
wandb: wandb version 0.16.0 is available!  To upgrade, please run:
wandb:  $ pip install wandb --upgrade
wandb: Tracking run with wandb version 0.15.3
wandb: Run data is saved locally in /home/korbinian/Documents/partial-model-merging/wandb/run-20231122_201530-z5dbfu4d
wandb: Run `wandb offline` to turn off syncing.
wandb: Syncing run dark-field-197
wandb: ⭐️ View project at https://wandb.ai/epistoteles/partial-model-merging
wandb: 🚀 View run at https://wandb.ai/epistoteles/partial-model-merging/runs/z5dbfu4d
Working... ━━━━━━━━━━━━━━━━━━━━━━━━━━━━━━━━━━━━━━━━ 100% 0:46:50
📥 Accuracies and losses saved for CIFAR10-ResNet20-bn-4.0x-b
train_acc    1.0
train_loss   0.00011975781701039522
test_acc     0.9471
test_loss    0.214222714304924
wandb: Waiting for W&B process to finish... (success).
wandb: - 0.002 MB of 0.002 MB uploaded (0.000 MB deduped)wandb: \ 0.002 MB of 0.002 MB uploaded (0.000 MB deduped)wandb: | 0.002 MB of 0.002 MB uploaded (0.000 MB deduped)wandb: / 0.002 MB of 0.002 MB uploaded (0.000 MB deduped)wandb: 
wandb: Run history:
wandb:          epoch ▁▁▁▁▂▂▂▂▂▃▃▃▃▃▃▄▄▄▄▄▅▅▅▅▅▅▆▆▆▆▆▇▇▇▇▇▇███
wandb:  learning_rate ▄███▇▇▇▇▇▇▆▆▆▆▆▅▅▅▅▅▅▄▄▄▄▄▃▃▃▃▃▃▂▂▂▂▂▁▁▁
wandb:  test_accuracy ▁▅▇▆▇▇▇▇▇▇▇▇▇▇▇▇▇▇▇▇▇▇█▇▇███████████████
wandb:      test_loss █▄▂▃▂▂▃▃▃▃▃▃▂▂▃▂▂▂▂▂▂▂▂▂▂▂▂▂▁▁▁▁▁▁▁▁▁▁▁▁
wandb: train_accuracy ▁▅▆▇▇▇▇▇████████████████████████████████
wandb:     train_loss █▄▃▂▂▂▂▂▂▁▁▁▁▁▁▁▁▁▁▁▁▁▁▁▁▁▁▁▁▁▁▁▁▁▁▁▁▁▁▁
wandb: 
wandb: Run summary:
wandb:          epoch 199
wandb:  learning_rate 0.0
wandb:  test_accuracy 0.9471
wandb:      test_loss 0.21422
wandb: train_accuracy 1.0
wandb:     train_loss 0.0004
wandb: 
wandb: 🚀 View run dark-field-197 at: https://wandb.ai/epistoteles/partial-model-merging/runs/z5dbfu4d
wandb: Synced 5 W&B file(s), 0 media file(s), 0 artifact file(s) and 0 other file(s)
wandb: Find logs at: ./wandb/run-20231122_201530-z5dbfu4d/logs
